"Pertanyaan","Jawaban Benar","Jawaban Salah 1","Jawaban Salah 2","Jawaban Salah 3","Jawaban Salah 4"
"Urutan yang diikuti dalam mendesain DBMS adalah","model konseptual, model logis, model fisik","model fisik model, konseptual, model logis","model konseptual, model logis, model fisik","model konseptual, model fisik, model logis","model fisik, model logis, model konseptual"
"Manakah dari berikut ini yang benar?","Skema database ditentukan selama desain database","Skema database sering berubah, tetapi status database tidak berubah","Skema database sering berubah","Skema database lebih sering berubah daripada status database","Skema database selalu tetap"
"DBMS yang mendukung database yang terletak di beberapa situs disebut DBMS...","terdistribusi","multi-user","terpusat","single-user","jaringan"
"Cocokkan pernyataan berikut ini:
1. View level  group
2. Conceptual level for community of users
3. Internal level
(a) Menjelaskan bagian dari database untuk pengguna tertentu
(b) Menjelaskan struktur database secara keseluruhan
(c) Menjelaskan bagian dari database untuk kelompok pengguna tertentu","1-c, 2-b, 3-a","1-b, 2-c, 3-a","1-b, 2-a, 3-c","1-a, 2-c, 3-b","1-a, 2-b, 3-c"
"Beberapa implementasi DBMS terdistribusi mendukung beberapa platform, sistem operasi, dan jaringan, dan mengizinkan ....","akses jarak jauh dengan hanya read-only","akses jarak jauh dengan hak menulis (write)","jumlah database berbeda yang tidak terbatas yang dapat diakses","akses ke model database apa pun","akses jarak jauh dengan hak membaca dan menulis (read and write)"
"Berikut ini manakah yang merupakan komponen perangkat lunak yang berada di setiap komputer yang menyimpan dan mengambil data yang ada di situs?","Data processor","Transaction processor","Network processor","Information processor","Memory processor"
"Dari pemartisian berikut ini, manakah yang mendistribusikan kolom tabel menjadi beberapa catatan fisik terpisah?","Vertical","Horizontal","Final","Crossways","Crossover"
"Manakah dari sistem database terdistribusi berikut yang hanya mengintegrasikan satu jenis DBMS terpusat melalui jaringan?","Homogeneous","Heterogeneous","Fully heterogeneous","Combination","Terdistribusi"
"Mendistribusikan baris data menjadi file terpisah disebut","horizontal partitioning","vertical partitioning","file allocation","normalization","random parizioning"
"Komponen perangkat lunak yang biasanya diperlukan untuk membangun database terdistribusi adalah
(i) Data processor 
(ii) User processor
(iii) Network transparency 
(iv) DDB
(v) Operating system support
Manakah dari pernyataan di atas yang benar?","(i), (ii), (iv)","(i), (ii), (iii)","(ii), (v)","(iv), (v)","(i), (ii)"
"Dalam _______________ sistem penguncian global diperlukan.","Shared disk architecture","Shared memory architecture","Shared nothing architecture","Shared memory architecture dan Shared disk architecture","semua arsitektur"
"Dalam arsitektur shared nothing, setiap CPU memiliki salinan sendiri dari","DBMS","Porsi data yang dikelola oleh DBMS","Sistem operasi","Semua","Tidak semua"
"Sistem manajemen basis data terdistribusi penuh tidak perlu","tunduk pada kompleksitas manajemen","melakukan semua fungsi DBMS terpusat","menjalankan fungsi tambahannya secara transparan kepada pengguna akhir","menjalankan fungsi tambahan pada DBMS terpusat","menangani semua fungsi penting yang diberlakukan oleh distribusi data dan pemrosesan"
"Yang bukan merupakan tujuan perlu  dilakukan pengukuran kinerja TI adalah  ","Terbentuknya arsitektur teknologi dan aplikasi yang menjadi target organisasi ( Target Architecture)","Mengetahui sejauh mana pemanfaatan investasi TI dalam mendukung kebutuhan organisasi","Agar pimpinan bisa mengetahui seberapa baik TI bisa berkontribusi pada kelangsungan bisnis organisasi","Dapat menjadi dasar perencanaan program atau proyek  TI ","Dasar pengadaan atau investasi TI"
"Melakukan pengukuran kinerja TI merupakan kegiatan membandingkan hasil kinerja TI secara aktual terhadap...","Key Performance Indicator (KPI) yang telah ditetapkan ","Hasil evaluasi dan koordinasi seluruh pemangku kepentingan di unit TI","Kapabilitas fungsi TI","Proses bisnis yang didukung oleh kinerja TI terkait",""
"Yang bukan merupakan sasaran penilaian performa TI adalah ","Arsitektur target aplikasi dan infrastruktur TI","Efisiensi penggunaan sumber daya dalam mendukung operasional layanan TI","Efektivitas setiap proses dan atau aktivitas dalam layanan TI","Kualitas layanan TI","Optimalisasi proses "
"Dalam mengukur performa TI, pengukuran tingkat ketercapaian tujuan dan sasaran strategis TI dan organisasi dapat diimplementasikan secara optimal dan mencapai hasil yang maksimal jika unit TI sudah menentukan hal berikut","Indikator dan ukuran kinerja yang jelas","Sumber daya yang terlibat dalam aktivitas pengukuran ","Framework atau kerangka kerja pengukuran ","Rencana evaluasi hasil pengukuran ","Daftar teknologi yang akan digunakan "
"Yang bukan termasuk tahapan kegiatan pengukuran performa TI adalah ","Audit TI","Analisa Data","Pengumpulan Data","Pengolahan data TI","Evaluasi hasil pengukuran "
"Mengetahui hasil kinerja IT berdasarkan cara pandang user menilai merupakan salah satu cara untuk mengukur performa TI berdasarkan IT Balanced Scorecard menurut perspective....","customer orientation","Coorporate contribution","operational exellence","Future Orientation ","Financial Contribution"
"Salah satu tujuan dari kegiatan pengukuran kinerja TI adalah melakukan penilaian terhadap kinerja TI. Hal berikut adalah bukan termasuk tujuan dilakukannya penilaian terhadap kinerja TI","Mendefinisikan proyek-proyek dan program TI serta cakupannya ","Meningkatkan visibilitas pada hasil yang akan diperoleh dari rencana TI yang sudah disusun ","Memperlihatkan korelasi yang jelas antara strategi institusi ","Memperlihatkan pengukuran secara kuantitatif terhadap rencana pengeluaran institusi ","Memperlihatkan dampak dan hubungan operasional TI terhadap anggaran atau keuangan institusi "
"Pengukuran performa TI dilakukan agar investasi TI yang sudah dilakukan dapat pertanggungjawabkan. Hal ini disebut juga dengan perspektive...","Akuntabilitas","Fleksibilitas ","Legalitas","Prioritas","aktivitas"
"Model yang digunakan untuk mengumpulkan kebutuhan pelanggan
terhadap perangkat lunak yang akan dibuat, dan merupakan program
yang belum jadi adalah model ... .","Prototipe","Internal","External","Jadi","Definitif"
"Suatu kumpulan pekerjaan yang saling terkait untuk menyelesaikan
suatu masalah tertentu disebut ... .","Bisnis Proses","Functional Requirement","Non Functional Requirement","Use Case","UML"
"Diagram tulang ikan yang berisikan sebab dan akibat dari sistem yang lama disebut ... .","diagram ishikawa","diagram pieces","diagram UML","diagram ERD","diagram relational"
"Seseorang ingin mengetahui sistem informasi yang dibuat harus sesuai dengan user yang menggunakannya. Untuk membantu menggambarkan hal tersebut, seseorang harus membuat ... .","use case diagram","data flow diagram","fishbone diagram","ishikawa diagram","sample diagram"
"Seseorang ingin mengetahui permasalahan-permasalahan yang terjadi pada sistem lama beserta penyebabnya, tools yang dapat digunakan untuk menggambarkan hal tersebut adalah ... .","diagram ishikawa","diagram pieces","diagram UML","diagram ERD","diagram relational"
"Seseorang ingin mengetahui jalannya suatu proses bisnis didalam sistem aplikasi, dari data yang berasal pada konsumen hingga tersimpan pada media database. Tools yang dapat digunakan untuk menggambarkan hal tersebut adalah ... .","data flow diagram","diagram ishikawa","diagram pieces","diagram UML","diagram ERD"
"Model yang digunakan dengan pendekatan alur secara sequential yang
dimulai dari Analisa, desain, pengkodean hingga pengujian adalah
model ... .","Waterfall","Agile","RnD","Prototipe","Network"
"Salah satu aplikasi dari apache yang dapat dimanfaatkan sebagai unit testing adalah ... .","Junit","Jmeter","Spark","Hadoop","Kafka"
"Salah satu pengujian yang menitikberatkan pada input,output serta memperhatikan proses didalamnya disebut ... .","white box testing","red testing","alpha testing","integration testing","black box testing"
"Pengujian perfomance aplikasi yang telah dapat dijalankan merupakah salah satu bentuk requirement ... .","non fungsional requirement","fungsional requirement","adaktif requirement","special requirement","non spesial requirement"
"Salah satu aplikasi dari apache yang dapat dimanfaatkan sebagai performance testing adalah ... .","Jmeter","Spark","Hadoop","Kafka","Junit"
"Salah satu pengujian yang menitikberatkan pada input dan output tanpa memperhatikan proses didalamnya disebut ... .","black box testing","white box testing","red testing","alpha testing","integration testing"
"Salah satu metode pengujian dimana menguji hanya pada salah satu fungsi yang sudah sesuai dengan input dan outputnya disebut ... .","unit testing","beta testing","performance testing","integration testing","acceptance testing"
"Berikut terdapat beberapa bukti fisik:
1. Nama dan deskripsi kegiatan
2. Langkah-langkah pengujian validasi terhadap hasil analisis kebutuhan
informasi
3. Hasil Pengujian yang sudah dilakukan
4. Kriteria validitas kebutuhan informasi
5. Hasil evaluasi dan dokumentasi terhadap hasil pengujian prosedur validasi
kebutuhan informasi
Hal yang termasuk ke dalam bukti penyusunan prosedur pengujian validasi kebutuhan informasi adalah ... .","1, 2, dan 4","1, 2 dan 5","2, 3 dan 4","2, 3 dan 5","3, 4 dan 5"